<?xml version="1.0" encoding="UTF-8"?>

<!-- ***************************************************************** -->
<!--                                                                   -->
<!-- IBM Confidential                                                  -->
<!--                                                                   -->
<!-- OCO Source Materials                                              -->
<!--                                                                   -->
<!-- Copyright IBM Corp. 2013, 2014                                    -->
<!--                                                                   -->
<!-- The source code for this program is not published or otherwise    -->
<!-- divested of its trade secrets, irrespective of what has been      -->
<!-- deposited with the U.S. Copyright Office.                         -->
<!--                                                                   -->
<!-- ***************************************************************** -->

<config xmlns="http://www.ibm.com/profiles-types" xmlns:pt="http://www.ibm.com/profiles-types"
	xmlns:tns="http://www.ibm.com/profiles-config" xmlns:xsi="http://www.w3.org/2001/XMLSchema-instance"
	id="profiles-types" xsi:schemaLocation="http://www.ibm.com/profiles-types profiles-types.xsd">
	<type>
		<parentId>snx:person</parentId>
		<id>snx:mtperson</id>
		<property>
			<ref>courtesyTitle</ref>
			<updatability>readwrite</updatability>
			<hidden>false</hidden>
		</property>
		<property>
			<ref>displayName</ref>
			<updatability>read</updatability>
			<hidden>false</hidden>
		</property>
		<property>
			<ref>title</ref>
			<updatability>readwrite</updatability>
			<hidden>false</hidden>
		</property>
		<!-- <property>
			<ref>nativeFirstName</ref>
			<updatability>readwrite</updatability>
			<hidden>false</hidden>
		</property> -->
		<property>
			<ref>givenName</ref>
			<updatability>readwrite</updatability>
			<hidden>false</hidden>
			<mapToNameTable>givenName</mapToNameTable>
		</property>
		<!-- <property>
			<ref>nativeLastName</ref>
			<updatability>readwrite</updatability>
			<hidden>false</hidden>
		</property> -->
		<property>
			<ref>surname</ref>
			<updatability>readwrite</updatability>
			<hidden>false</hidden>
			<mapToNameTable>surname</mapToNameTable>
		</property>
		<property>
			<ref>preferredFirstName</ref>
			<updatability>readwrite</updatability>
			<hidden>false</hidden>
			<mapToNameTable>givenName</mapToNameTable>
		</property>
		<property>
			<ref>preferredLastName</ref>
			<updatability>readwrite</updatability>
			<hidden>false</hidden>
			<mapToNameTable>surname</mapToNameTable>
		</property>
		<property>
			<ref>employeeNumber</ref>
			<updatability>read</updatability>
			<hidden>false</hidden>
		</property>
		<property>
			<ref>telephoneNumber</ref>
			<updatability>readwrite</updatability>
			<hidden>false</hidden>
		</property>
		<property>
			<ref>mobileNumber</ref>
			<updatability>readwrite</updatability>
			<hidden>false</hidden>
		</property>
		<property>
			<ref>faxNumber</ref>
			<updatability>readwrite</updatability>
			<hidden>false</hidden>
		</property>
		<property>
			<ref>email</ref>
			<updatability>read</updatability>
			<hidden>false</hidden>
			<mapToNameTable>surname</mapToNameTable>
		</property>
		<property>
			<ref>deptNumber</ref>
			<updatability>readwrite</updatability>
			<hidden>false</hidden>
		</property>
		<property>
			<ref>officeName</ref>
			<updatability>readwrite</updatability>
			<hidden>false</hidden>
		</property>
		<property>
			<ref>description</ref>
			<updatability>readwrite</updatability>
			<hidden>false</hidden>
			<richText>true</richText>
		</property>
		<property>
			<ref>experience</ref>
			<updatability>readwrite</updatability>
			<hidden>false</hidden>
			<richText>true</richText>
		</property>
		<property>
			<ref>timezone</ref>
			<updatability>readwrite</updatability>
			<hidden>false</hidden>
		</property>
		<property>
			<ref>profileLinks</ref>
			<updatability>readwrite</updatability>
			<hidden>false</hidden>
		</property>
	</type>
	
	<type>
		<parentId>snx:mtperson</parentId>
		<id>default</id>
	</type>
</config>